{
  "schema_version": 1,
  "upstream_commit": "5d84f3f222b41409a6983d2ac90513ad9702fa9e",
  "loaded_library_sha256": "9ed1d46d2d60bac2966fd03bd81e7d192025804f6a3e3ef24c3aa483d0ec7c1e",
  "native_driver_sha256": "36045948b15941b206aebd381b00568f45e8f6fab477243ccbe6f32800479925",
  "native_driver_source_sha256": "bf6be75bfde4b93c687b05d8323504378d4311f977db2dbcb1736b5b9fefa229",
  "generator_sha256": "3ec1e9b4ab384b3edeb9d0248e47e28c23ba1279bce6a6b44a755fa6a73650e6",
  "source_sha256": {
    "src/io/metadata.cpp": "b977d54d48d36c2c16aa0197962cd935ebba0b89f4b1e721c2f493d8e6c5c266",
    "src/objective/rank_objective.hpp": "865f9f4735564a80a1ba49bbeb2f2e25f08c41bfbcc398838c82eba60ac8eeaa",
    "src/metric/rank_metric.hpp": "bb4968685c74ab34b2db49348c367c99feb97344e9c2748303e93f9a2c74e4f4",
    "src/metric/map_metric.hpp": "d052be30d399993ff933b325056b255498031f0207d13353fccb81f3c0691b69",
    "src/boosting/bagging.hpp": "8feae67b152c4853b80181841625fb34cf252ce9d020f9026654229cefe57d49"
  },
  "restrictions": {
    "lambdarank_empty": "Not executed: rank_objective.hpp:201 indexes sorted_idx[0] when cnt=0 (undefined behavior).",
    "weighted_empty": "Not executed: metadata.cpp:852-864 divides query weight sum by zero; no finite query-weight semantics.",
    "query_bagging_queries_exceed_rows": "Not executed: bagging.hpp:176-181 sizes bag_query_indices_ and bagging_rands_ by num_data_ but indexes them with query indexes.",
    "row_subset_empty": "Not executed: metadata.cpp:144-161 indexes data_idx + len - 1 for zero-length groups; identity subsets preserve all query entries in Rust."
  },
  "cases": [
    {
      "boundaries": [
        0,
        2,
        4
      ],
      "groups": [
        2,
        2
      ],
      "labels": [
        0,
        1,
        1,
        0
      ],
      "name": "nonempty",
      "steps": [
        {
          "gradients": [
            0.2409718781709671,
            -0.2409718781709671,
            -0.6025676727294922,
            0.6025676727294922
          ],
          "hessians": [
            0.2287842333316803,
            0.2287842333316803,
            0.2217128723859787,
            0.2217128723859787
          ],
          "metrics": [
            {
              "name": "ndcg@1",
              "value": 0
            },
            {
              "name": "ndcg@2",
              "value": 0.6309297535714575
            },
            {
              "name": "ndcg@3",
              "value": 0.6309297535714575
            },
            {
              "name": "ndcg@4",
              "value": 0.6309297535714575
            },
            {
              "name": "ndcg@5",
              "value": 0.6309297535714575
            },
            {
              "name": "map@1",
              "value": 0
            },
            {
              "name": "map@2",
              "value": 0.5
            },
            {
              "name": "map@3",
              "value": 0.5
            },
            {
              "name": "map@4",
              "value": 0.5
            },
            {
              "name": "map@5",
              "value": 0.5
            }
          ],
          "scores": [
            0.4,
            -0.2,
            0.1,
            0.8
          ]
        },
        {
          "gradients": [
            0.4373760521411896,
            -0.4373760521411896,
            -0.6207646727561951,
            0.6207646727561951
          ],
          "hessians": [
            0.2217128723859787,
            0.2217128723859787,
            0.2287842333316803,
            0.2287842333316803
          ],
          "metrics": [
            {
              "name": "ndcg@1",
              "value": 0
            },
            {
              "name": "ndcg@2",
              "value": 0.6309297535714575
            },
            {
              "name": "ndcg@3",
              "value": 0.6309297535714575
            },
            {
              "name": "ndcg@4",
              "value": 0.6309297535714575
            },
            {
              "name": "ndcg@5",
              "value": 0.6309297535714575
            },
            {
              "name": "map@1",
              "value": 0
            },
            {
              "name": "map@2",
              "value": 0.5
            },
            {
              "name": "map@3",
              "value": 0.5
            },
            {
              "name": "map@4",
              "value": 0.5
            },
            {
              "name": "map@5",
              "value": 0.5
            }
          ],
          "scores": [
            0.8,
            0.1,
            -0.2,
            0.4
          ]
        },
        {
          "gradients": [
            0.41951656341552734,
            -0.41951656341552734,
            -0.6207646727561951,
            0.6207646727561951
          ],
          "hessians": [
            0.2287842333316803,
            0.2287842333316803,
            0.2287842333316803,
            0.2287842333316803
          ],
          "metrics": [
            {
              "name": "ndcg@1",
              "value": 0
            },
            {
              "name": "ndcg@2",
              "value": 0.6309297535714575
            },
            {
              "name": "ndcg@3",
              "value": 0.6309297535714575
            },
            {
              "name": "ndcg@4",
              "value": 0.6309297535714575
            },
            {
              "name": "ndcg@5",
              "value": 0.6309297535714575
            },
            {
              "name": "map@1",
              "value": 0
            },
            {
              "name": "map@2",
              "value": 0.5
            },
            {
              "name": "map@3",
              "value": 0.5
            },
            {
              "name": "map@4",
              "value": 0.5
            },
            {
              "name": "map@5",
              "value": 0.5
            }
          ],
          "queries": [
            0
          ],
          "scores": [
            0.4,
            -0.2,
            0.1,
            0.8
          ]
        },
        {
          "gradients": [
            0.5992387533187866,
            -0.5992387533187866,
            -0.308258056640625,
            0.308258056640625
          ],
          "hessians": [
            0.2287842333316803,
            0.2287842333316803,
            0.2217128723859787,
            0.2217128723859787
          ],
          "metrics": [
            {
              "name": "ndcg@1",
              "value": 0
            },
            {
              "name": "ndcg@2",
              "value": 0.6309297535714575
            },
            {
              "name": "ndcg@3",
              "value": 0.6309297535714575
            },
            {
              "name": "ndcg@4",
              "value": 0.6309297535714575
            },
            {
              "name": "ndcg@5",
              "value": 0.6309297535714575
            },
            {
              "name": "map@1",
              "value": 0
            },
            {
              "name": "map@2",
              "value": 0.5
            },
            {
              "name": "map@3",
              "value": 0.5
            },
            {
              "name": "map@4",
              "value": 0.5
            },
            {
              "name": "map@5",
              "value": 0.5
            }
          ],
          "scores": [
            0.4,
            -0.2,
            0.1,
            0.8
          ]
        }
      ],
      "training": {
        "params": {
          "objective": "rank_xendcg",
          "objective_seed": 7,
          "metric": [
            "ndcg",
            "map"
          ],
          "num_threads": 1,
          "verbosity": -1,
          "min_data_in_leaf": 1,
          "min_data_in_bin": 1,
          "feature_pre_filter": false,
          "enable_bundle": false,
          "num_leaves": 3,
          "learning_rate": 0.1,
          "deterministic": true,
          "force_col_wise": true
        },
        "rounds": 3,
        "predictions": [
          [
            0.0,
            0.0,
            0.17375196218490532,
            -0.17375196218490532
          ],
          [
            -0.10767531394958454,
            0.1336341767057276,
            0.30738613889063293,
            -0.33413661057217997
          ],
          [
            -0.19445604425368274,
            0.2204149070098258,
            0.30738613889063293,
            -0.33413661057217997
          ]
        ],
        "metrics": {
          "ndcg@1": [
            0.5,
            1.0,
            1.0
          ],
          "ndcg@2": [
            0.8154648767857288,
            1.0,
            1.0
          ],
          "ndcg@3": [
            0.8154648767857288,
            1.0,
            1.0
          ],
          "ndcg@4": [
            0.8154648767857288,
            1.0,
            1.0
          ],
          "ndcg@5": [
            0.8154648767857288,
            1.0,
            1.0
          ],
          "map@1": [
            0.5,
            1.0,
            1.0
          ],
          "map@2": [
            0.75,
            1.0,
            1.0
          ],
          "map@3": [
            0.75,
            1.0,
            1.0
          ],
          "map@4": [
            0.75,
            1.0,
            1.0
          ],
          "map@5": [
            0.75,
            1.0,
            1.0
          ]
        },
        "trees": 3
      },
      "query_bagging": {
        "params": {
          "objective": "rank_xendcg",
          "objective_seed": 7,
          "metric": [
            "ndcg",
            "map"
          ],
          "num_threads": 1,
          "verbosity": -1,
          "min_data_in_leaf": 1,
          "min_data_in_bin": 1,
          "feature_pre_filter": false,
          "enable_bundle": false,
          "num_leaves": 3,